# Create a table
statement ok
create table t1(v1 int primary key, v2 int, v3 int);

statement ok
insert into t1 values (1, 50, 645), (2, 40, 721), (4, 20, 445), (5, 10, 445), (3, 30, 645);

# Build index
statement ok
create index t1v1 on t1(v1);

statement ok
create index t1v2 on t1(v2);

statement ok
explain select * from t1 where v1 = 1;

statement ok
explain select * from t1 where v2 = 10;

statement ok
explain select * from t1 where v3 = 721;

statement ok
explain select * from t1 where v1 = 1 and v2 = 50;

statement ok
explain select * from t1 where v2 = 4 and v3 = 445;

query III
select * from t1 where v1 = 1;
----
1 50 645

query III
select * from t1 where v2 = 40;
----
2 40 721

statement ok
explain select * from t1 where v1 = 1 or v1 = 2;

query III rowsort
select * from t1 where v1 = 1 or v1 = 2;
----
1 50 645
2 40 721

query III
select * from t1 where v1 = 1 and v2 = 50;
----
1 50 645

query III
select * from t1 where v3 = 721;
----
2 40 721

# Insert more elements
statement ok
insert into t1 values (6, 0, 721), (7, -10, 645);

query III
select * from t1 where v1 = 6;
----
6 0 721


query III
select * from t1 where v2 = -10;
----
7 -10 645

# Update some elements
statement ok
update t1 set v3 = 645, v1 = 8, v2 = -20 where v1 = 2;

query III
select * from t1 where v1 = 8;
----
8 -20 645

query III
select * from t1 where v1 = 2;
----


query III
select * from t1 where v2 = -20;
----
8 -20 645

query III
select * from t1 where v2 = 20;
----
4 20 445

query III rowsort
select * from t1 where v1 = 7 or 3 = v1;
----
3 30 645
7 -10 645

query III
select * from t1 where v2 = 40;
----


query III
select * from t1 where v2 = 90;
----


statement ok
update t1 set v1 = 2 where v1 = 8;

# Delete some elements
statement ok
delete from t1 where v1 = 2;

query III
select * from t1 where v1 = 2;
----


query III
select * from t1 where v2 = -20;
----


query III
select * from t1 where v2 = 20;
----
4 20 445


query III
select * from t1 where v3 = 721;
----
6 0 721

query III
select * from t1 where v2 = 50 and v3 = 645;
----
1 50 645

query III
select * from t1 where v2 = 0 and v3 = 721;
----
6 0 721

query III
select * from t1 where v1 = 7 or 10 = v2;
----
5 10 445
7 -10 645

query III rowsort
select * from t1 where v1 = 7 or v1 = 3 or 5 = v1;
----
3 30 645
5 10 445
7 -10 645

query III
select * from t1 where v1 = 3 or v1 = 3 or v1 = 3
----
3 30 645

query III rowsort
select * from t1 where v1 = 3 or v1 = 5 or v1 = 1 or v1 = 5
----
1 50 645
3 30 645
5 10 445

query III rowsort
select * from t1 where v1 = 7 or v1 = 3 or 5 = v1 or 3 = v2;
----
3 30 645
5 10 445
7 -10 645

# Delete some elements
statement ok
delete from t1 where v2 = 30;

query III
select * from t1 where v1 = 3;
----


query III
select * from t1 where v1 = 2;
----


query III
select * from t1 where v2 = 30;
----


query III
select * from t1 where v2 = 40;
----


query III
select * from t1 where v2 = 50;
----
1 50 645

# Delete all
statement ok
delete from t1;


query III
select * from t1 where v1 = 1;
----


query III
select * from t1 where v2 = 10;
----


query III
select * from t1 where v1 = 1 and v2 = 50;
----


query III
select * from t1 where v3 = 721;
----


# Insert more elements
statement ok
insert into t1 values (6, 0, 445), (7, -10, 645), (8, 10, 445);

query III
select * from t1 where v1 = 6;
----
6 0 445

query III
select * from t1 where v2 = -10;
----
7 -10 645

query III
select * from t1 where v2 = 10;
----
8 10 445

query III
select * from t1 where v3 = 10;
----
