# SimpleDeleteSQLTest

statement ok
CREATE TABLE department_table (dept_id INT PRIMARY KEY, dept_name VARCHAR);

statement ok
INSERT INTO department_table(dept_id,dept_name) VALUES (1,'hello_1');

query T
SELECT dept_name from department_table;
----
hello_1

statement ok
INSERT INTO department_table(dept_id,dept_name) VALUES (2,'hello_2');

statement ok
INSERT INTO department_table(dept_id,dept_name) VALUES (3,'hello_3');

query I
SELECT count(dept_name) from department_table;
----
3

query I
SELECT max(dept_id) FROM department_table;
----
3

statement ok
DELETE FROM department_table WHERE dept_id < 3;

query T
SELECT dept_name from department_table;
----
hello_3

statement ok
DELETE FROM department_table;

query T
SELECT dept_name from department_table;
----
