# PerformanceTest

statement ok
CREATE TABLE test(a INT PRIMARY KEY, b INT, c INT, d INT, e TEXT);

statement ok
CREATE INDEX idx_order ON test (b,c);

statement ok
INSERT INTO test SELECT i, 1, (random() + 1) * 50, i, '2016-12-06 00:00:02-04' FROM generate_series(0, 99) as s (i);

statement ok
SELECT c from test WHERE b=1 ORDER BY c LIMIT 10;

statement ok
SELECT c from test WHERE b=1 ORDER BY c;

# OrderByWithColumnsTest

include fixtures/order_by.slt.inc

query II
SELECT a, b FROM test ORDER BY b;
----
3 11
1 22
2 33

# OrderByWithColumnsDescTest

include fixtures/order_by.slt.inc

query II
SELECT a, b FROM test ORDER BY b DESC;
----
2 33
1 22
3 11

# OrderByWithoutColumnsTest

include fixtures/order_by.slt.inc

query I
SELECT a FROM test ORDER BY b;
----
3
1
2

# OrderByWithoutColumnsDescTest

include fixtures/order_by.slt.inc

query I
SELECT a FROM test ORDER BY b DESC;
----
2
1
3

# OrderByWithColumnsAndLimitTest

include fixtures/order_by.slt.inc

query IIT
SELECT a, b, d FROM test ORDER BY d LIMIT 2;
----
1 22 abcd
3 11 bcd

# OrderByWithColumnsAndLimitDescTest

include fixtures/order_by.slt.inc

query IIT
SELECT a, b, d FROM test ORDER BY d DESC LIMIT 2;
----
2 33 bcda
3 11 bcd

# OrderByWithoutColumnsAndLimitTest

include fixtures/order_by.slt.inc

query I
SELECT a FROM test ORDER BY d LIMIT 2;
----
1
3

# OrderByWithoutColumnsAndLimitDescTest

include fixtures/order_by.slt.inc

query I
SELECT a FROM test ORDER BY d DESC LIMIT 2;
----
2
3

# OrderByStar

include fixtures/order_by.slt.inc

query IIIT
SELECT * FROM test ORDER BY d;
----
1 22 333 abcd
3 11 222 bcd
2 33 111 bcda

# OrderByStarDesc

include fixtures/order_by.slt.inc

query IIIT
SELECT * FROM test ORDER BY d DESC;
----
2 33 111 bcda
3 11 222 bcd
1 22 333 abcd

# OrderByStarWithLimit

include fixtures/order_by.slt.inc

query IIIT
SELECT * FROM test ORDER BY d LIMIT 2;
----
1 22 333 abcd
3 11 222 bcd

# OrderByStarWithLimitDesc

include fixtures/order_by.slt.inc

query IIIT
SELECT * FROM test ORDER BY d DESC LIMIT 2;
----
2 33 111 bcda
3 11 222 bcd

# OrderByWithProjectionTest

include fixtures/order_by.slt.inc

statement ok
UPDATE test set b = b - 20 WHERE b = 11;

query I
SELECT (b * -1) as val FROM test ORDER BY b;
----
9
-22
-33

# OrderByWithProjectionDescTest

include fixtures/order_by.slt.inc

statement ok
UPDATE test set b = b - 20 WHERE b = 11;

query I
SELECT (b * -1) as val FROM test ORDER BY b DESC;
----
-33
-22
9

# OrderByWithProjectionLimitTest

include fixtures/order_by.slt.inc

statement ok
UPDATE test set b = b - 20 WHERE b = 11;

query I
SELECT (b * -1) as val FROM test ORDER BY b LIMIT 2;
----
9
-22

# OrderByWithProjectionLimitDescTest

include fixtures/order_by.slt.inc

statement ok
UPDATE test set b = b - 20 WHERE b = 11;

query I
SELECT (b * -1) as val FROM test ORDER BY b DESC LIMIT 2;
----
-33
-22

# OrderByWithNullCheck

include fixtures/order_by.slt.inc

statement ok
INSERT INTO test VALUES
    (4, 55, 222, 'aaa'),
    (5, NULL, 222, 'ccc'),
    (6, 44, NULL, 'bbb'),
    (7, 66, 555, NULL),
    (8, NULL, 222, NULL);

query I
SELECT b FROM test ORDER BY b;
----
11
22
33
44
55
66
NULL
NULL

query I
SELECT b FROM test ORDER BY b DESC;
----
NULL
NULL
66
55
44
33
22
11

query T
SELECT d FROM test ORDER BY d;
----
aaa
abcd
bbb
bcd
bcda
ccc
NULL
NULL

query T
SELECT d FROM test ORDER BY d DESC;
----
NULL
NULL
ccc
bcda
bcd
bbb
abcd
aaa
