# Based on https://github.com/cmu-db/peloton/blob/484d76df9344cb5c153a2c361c5d5018912d4cf4/test/sql/order_by_sql_test.cpp

statement ok
CREATE TABLE test (a INT PRIMARY KEY, b INT, c INT, d VARCHAR);

statement ok
INSERT INTO test VALUES
    (1, 22, 333, 'abcd'),
    (2, 33, 111, 'bcda'),
    (3, 11, 222, 'bcd');

# OrderByWithColumnsTest
query II
SELECT a, b FROM test ORDER BY b;
----
3 11
1 22
2 33

# OrderByWithColumnsDescTest
query II
SELECT a, b FROM test ORDER BY b DESC;
----
2 33
1 22
3 11

# OrderByWithoutColumnsTest
query I
SELECT a FROM test ORDER BY b;
----
3
1
2

# OrderByWithoutColumnsDescTest
query I
SELECT a FROM test ORDER BY b DESC;
----
2
1
3

# OrderByWithColumnsAndLimitTest
query IIT
SELECT a, b, d FROM test ORDER BY d LIMIT 2;
----
1 22 abcd
3 11 bcd

# OrderByWithColumnsAndLimitDescTest
query IIT
SELECT a, b, d FROM test ORDER BY d DESC LIMIT 2;
----
2 33 bcda
3 11 bcd

# OrderByWithoutColumnsAndLimitTest
query I
SELECT a FROM test ORDER BY d LIMIT 2;
----
1
3

# OrderByWithoutColumnsAndLimitDescTest
query I
SELECT a FROM test ORDER BY d DESC LIMIT 2;
----
2
3

# OrderByStar
query IIIT
SELECT * FROM test ORDER BY d;
----
1 22 333 abcd
3 11 222 bcd
2 33 111 bcda

# OrderByStarDesc
query IIIT
SELECT * FROM test ORDER BY d DESC;
----
2 33 111 bcda
3 11 222 bcd
1 22 333 abcd

# OrderByStarWithLimit
query IIIT
SELECT * FROM test ORDER BY d LIMIT 2;
----
1 22 333 abcd
3 11 222 bcd

# OrderByStarWithLimitDesc
query IIIT
SELECT * FROM test ORDER BY d DESC LIMIT 2;
----
2 33 111 bcda
3 11 222 bcd

statement ok
UPDATE test SET b = b - 20 WHERE b = 11;

# OrderByWithProjectionTest
query I
SELECT (b * -1) AS val FROM test ORDER BY b;
----
9
-22
-33

# OrderByWithProjectionDescTest
query I
SELECT (b * -1) AS val FROM test ORDER BY b DESC;
----
-33
-22
9

# OrderByWithProjectionLimitTest
query I
SELECT (b * -1) AS val FROM test ORDER BY b LIMIT 2;
----
9
-22

# OrderByWithProjectionLimitDescTest
query I
SELECT (b * -1) AS val FROM test ORDER BY b DESC LIMIT 2;
----
-33
-22

statement ok
TRUNCATE TABLE test;

# OrderByWithNullCheck

statement ok
INSERT INTO test VALUES
    (1, 22, 333, 'abcd'),
    (2, 33, 111, 'bcda'),
    (3, 11, 222, 'bcd'),
    (4, 55, 222, 'aaa'),
    (5, NULL, 222, 'ccc'),
    (6, 44, NULL, 'bbb'),
    (7, 66, 555, NULL),
    (8, NULL, 222, NULL);

query I
SELECT b FROM test ORDER BY b;
----
11
22
33
44
55
66
NULL
NULL

query I
SELECT b FROM test ORDER BY b DESC;
----
NULL
NULL
66
55
44
33
22
11

query T
SELECT d FROM test ORDER BY d;
----
aaa
abcd
bbb
bcd
bcda
ccc
NULL
NULL

query T
SELECT d FROM test ORDER BY d DESC;
----
NULL
NULL
ccc
bcda
bcd
bbb
abcd
aaa
