# UpdatePrimaryIndexTest

statement ok
CREATE TABLE test(a INT PRIMARY KEY, b INT, c INT);

statement ok
INSERT INTO test VALUES
    (1, 10, 100),
    (2, 20, 200),
    (3, 30, 300);

query III
SELECT * FROM test;
----
1 10 100
2 20 200
3 30 300

statement error
UPDATE test SET a=2 WHERE c=300;

query III
SELECT * from test;
----
1 10 100
2 20 200
3 30 300

statement ok
UPDATE test SET a=5 WHERE c=300;

query III
SELECT * from test;
----
1 10 100
2 20 200
5 30 300

statement ok
UPDATE test SET b=2000 WHERE c=200;

query III
SELECT * FROM test WHERE b=2000;
----
2 2000 200
