# UpdateSecondaryIndexTest

statement ok
CREATE TABLE test (a INT PRIMARY KEY, b INT, c INT);

statement ok
INSERT INTO test VALUES
    (1, 10, 100),
    (2, 20, 200),
    (3, 30, 300);

statement ok
CREATE UNIQUE INDEX b_idx on test (b);

query III
SELECT * FROM test;
----
1 10 100
2 20 200
3 30 300

statement ok
UPDATE test SET b=1000 WHERE c=200;

query III
SELECT * FROM test WHERE b=1000;
----
2 1000 200
